{
  "$schema": "https://json-schema.org/draft/2020-12/schema",
  "$id": "https://pica.community/schema/ci-job-v1.schema.json",
  "title": "Pica CI job",
  "description": "One package's fetch-and-build declaration, consumed by .github/scripts/fetch_assets.py and the release workflow.",
  "type": "object",
  "required": ["mgr", "id", "manifest", "source", "build"],
  "properties": {
    "schema": { "const": "pica-ci-job-v1" },
    "mgr": {
      "enum": ["opkg", "apk", "pica"],
      "description": "Backend this job builds for. Assets land in pkgs/<mgr>/, so it must match the manifest's targets."
    },
    "id": {
      "type": "string",
      "minLength": 1,
      "description": "Package directory name under src/<mgr>/. Suffixes like @immortalwrt are allowed for variants."
    },
    "enabled": {
      "type": "boolean",
      "default": true,
      "description": "Set false to skip this package without deleting it."
    },
    "manifest": {
      "type": "string",
      "minLength": 1,
      "description": "Path to the source manifest, e.g. src/opkg/openclash/manifest. The manifest declares targets; this file must not."
    },
    "source": {
      "type": "object",
      "required": ["provider"],
      "properties": {
        "provider": {
          "enum": ["github", "http_template", "tarball"],
          "description": "github reads a release; http_template expands url_template with {arch}/{version}/{platform}; tarball downloads an archive and unpacks it into the package's root/."
        },
        "repo": {
          "type": "string",
          "description": "owner/name. Required when provider is github."
        },
        "version": {
          "type": "string",
          "description": "Literal or {latest}. Used by http_template."
        },
        "url_template": { "type": "string" },
        "url_templates": {
          "type": "array",
          "items": { "type": "string" }
        },
        "arch_url_templates": {
          "type": "object",
          "description": "Per-architecture URL templates, read only by the http_template provider. When an arch has an entry, those templates replace url_template/url_templates for that arch, so one architecture can fetch a different version without that URL being downloaded into every other architecture's directory. Arches without an entry keep the common list. Keys are build.matrix arch values.",
          "additionalProperties": {
            "type": "array",
            "items": { "type": "string" }
          }
        },
        "strip_components": {
          "type": "integer",
          "minimum": 0,
          "description": "How many leading path components to drop while unpacking a tarball. A release archive usually wraps everything in one directory tied to the release (`fastfetch-musl-amd64/usr/bin/...`); leaving that wrapper in would put the files at the wrong depth, so the binary would not land where the manifest says it is. Read only by the tarball provider."
        },
        "include": {
          "type": "array",
          "items": { "type": "string" },
          "description": "Paths to keep when unpacking a tarball; a path under one of these prefixes is written and anything else in the archive is skipped. A full upstream archive also carries shell completions and man pages that a router has no use for. Read only by the tarball provider."
        },
        "dest_subdir": {
          "type": "string",
          "description": "Optional subdirectory of root/ to unpack into. Empty, the usual case, puts the files straight into root/, which is what a `pica` artifact wants: root/ is deployed as it stands, so a per-architecture directory there would reach the device as a directory at the filesystem root."
        },
        "rename": {
          "type": "string",
          "description": "Name to give a download that is not an archive. A release of one bare binary is a single file whose name is the upstream's (`cloudflared-linux-amd64`), and the device wants it where the manifest says (`cloudflared`); this is what puts it there. Read only by the tarball provider, and ignored for an archive, whose members keep the names they had inside it."
        },
        "arch_map": {
          "type": "object",
          "additionalProperties": { "type": "string" },
          "description": "For the tarball provider, renames each matrix architecture for the URL, for a source that names them its own way — a Go project calls x86_64 `amd64` and aarch64 `arm64`; an architecture not listed here is substituted as it stands. For the github provider, maps a captured asset architecture (e.g. `aarch64`) to a matrix architecture (e.g. `aarch64_generic`)."
        },
        "release": {
          "type": "object",
          "properties": {
            "tag": {
              "type": "object",
              "properties": {
                "mode": { "enum": ["regex", "exact", "latest"] },
                "regex": { "type": "string" },
                "value": { "type": "string" }
              },
              "additionalProperties": false
            },
            "allow_prerelease": { "type": "boolean" },
            "assets": {
              "type": "array",
              "items": { "$ref": "#/$defs/asset" }
            }
          },
          "required": ["assets"],
          "additionalProperties": false
        }
      },
      "additionalProperties": true
    },
    "versioning": {
      "type": "object",
      "properties": {
        "pkgver": {
          "type": "object",
          "properties": {
            "from": { "enum": ["manifest", "asset", "tag"] },
            "fallback": {}
          },
          "additionalProperties": true
        },
        "pkgrel": {
          "type": "object",
          "properties": {
            "from": { "enum": ["manifest", "fixed"] },
            "fallback": {}
          },
          "additionalProperties": true
        },
        "arch_versions": {
          "type": "object",
          "additionalProperties": { "type": "string" },
          "description": "Per-architecture upstream versions when the feed genuinely ships different versions. The manifest pkgver is used for architectures not listed here; the version audit accepts a listed architecture only when its URL carries the listed version."
        }
      },
      "additionalProperties": true
    },
    "build": {
      "type": "object",
      "required": ["matrix"],
      "properties": {
        "matrix": {
          "type": "array",
          "minItems": 1,
          "items": {
            "type": "object",
            "required": ["platform", "arch"],
            "properties": {
              "platform": { "type": "string", "minLength": 1 },
              "arch": { "type": "string", "minLength": 1 }
            },
            "additionalProperties": false
          },
          "description": "One build variant per <platform>/<arch> combination."
        },
        "include_dirs": {
          "type": "array",
          "items": { "enum": ["scripts", "root", "pkgs"] },
          "description": "Optional. The package layout these are the only directories pica-pack reads."
        },
        "pack": {
          "type": "object",
          "properties": {
            "tool": { "const": "pica-pack" },
            "format": { "const": "pkg.tar.gz" }
          },
          "additionalProperties": false
        }
      },
      "additionalProperties": true
    },
    "publish": {
      "type": "object",
      "properties": {
        "registry_db": { "type": "string" },
        "keep_release_history": { "type": "integer", "minimum": 0 }
      },
      "additionalProperties": false
    }
  },
  "$defs": {
    "asset": {
      "type": "object",
      "required": ["name", "regex"],
      "properties": {
        "name": { "type": "string", "minLength": 1 },
        "role": {
          "enum": ["app", "base", "kmod", "luci", "i18n", "config", "data"],
          "description": "What the asset contributes to the manifest."
        },
        "regex": {
          "type": "string",
          "minLength": 1,
          "description": "Matched against the upstream asset filename."
        },
        "inner_regex": {
          "type": "string",
          "description": "For zip assets: the member to extract."
        },
        "required": {
          "type": "boolean",
          "default": true,
          "description": "Fail the job when no asset matches."
        },
        "capture_to": {
          "type": "object",
          "description": "Maps a named regex group to platform or arch.",
          "properties": {
            "platform": { "type": "integer" },
            "arch": { "type": "integer" }
          },
          "additionalProperties": false
        },
        "target": {
          "type": "object",
          "properties": {
            "platform": { "type": "string" },
            "arch": { "type": "string" }
          },
          "additionalProperties": false
        }
      },
      "additionalProperties": false
    }
  },
  "additionalProperties": false
}