{
  "schema": "pica-ci-job-v1",
  "mgr": "opkg",
  "id": "rtp2httpd",
  "enabled": true,
  "manifest": "src/opkg/rtp2httpd/manifest",
  "source": {
    "provider": "github",
    "repo": "stackia/rtp2httpd",
    "release": {
      "tag": {
        "mode": "regex",
        "regex": "^v?[0-9.]+$"
      },
      "allow_prerelease": false,
      "assets": [
        {
          "name": "rtp2httpd-core",
          "role": "app",
          "regex": "^rtp2httpd_.*_(x86_64|mipsel_24kc)\\.ipk$",
          "required": true,
          "capture_to": {
            "arch": 1
          }
        }
      ]
    }
  },
  "versioning": {
    "pkgver": {
      "from": "manifest",
      "fallback": "3.9.1"
    },
    "pkgrel": {
      "from": "manifest",
      "fallback": 1
    }
  },
  "build": {
    "matrix": [
      {
        "platform": "amd64",
        "arch": "x86_64"
      },
      {
        "platform": "mipsel",
        "arch": "mipsel_24kc"
      }
    ],
    "include_dirs": [
      "scripts",
      "root",
      "pkgs"
    ],
    "pack": {
      "tool": "pica-pack",
      "format": "pkg.tar.gz"
    }
  },
  "publish": {
    "registry_db": "r/opkg/rtp2httpd/db.json",
    "keep_release_history": 1
  }
}
