{
  "schema": "pica-ci-job-v1",
  "mgr": "opkg",
  "id": "adguardhome",
  "enabled": true,
  "manifest": "src/opkg/adguardhome/manifest",
  "source": {
    "provider": "github",
    "repo": "rufengsuixing/luci-app-adguardhome",
    "release": {
      "tag": {
        "mode": "regex",
        "regex": "^v?[0-9]+(?:[.-][0-9]+)*$"
      },
      "allow_prerelease": false,
      "assets": [
        {
          "name": "luci-app",
          "role": "luci",
          "regex": "^luci-app-adguardhome_.*_all\\.ipk$",
          "required": true,
          "target": {
            "platform": "all",
            "arch": "all"
          }
        }
      ]
    }
  },
  "versioning": {
    "pkgver": {
      "from": "manifest",
      "fallback": "1.8.9"
    },
    "pkgrel": {
      "from": "manifest",
      "fallback": 1
    }
  },
  "build": {
    "matrix": [
      {
        "platform": "all",
        "arch": "all"
      }
    ],
    "include_dirs": [
      "scripts",
      "root",
      "pkgs"
    ],
    "pack": {
      "tool": "pica-pack",
      "format": "pkg.tar.gz"
    }
  },
  "publish": {
    "registry_db": "r/opkg/adguardhome/db.json",
    "keep_release_history": 1
  }
}
