{
  "schema": "pica-ci-job-v1",
  "mgr": "opkg",
  "id": "ua3f",
  "enabled": true,
  "manifest": "src/opkg/ua3f/manifest",
  "source": {
    "provider": "github",
    "repo": "SunBK201/UA3F",
    "release": {
      "tag": {
        "mode": "regex",
        "regex": "^v?[0-9]+(?:\\.[0-9]+)*$"
      },
      "allow_prerelease": false,
      "assets": [
        {
          "name": "ua3f",
          "role": "app",
          "regex": "^ua3f_[0-9].*_(.*)\\.ipk$",
          "required": true,
          "target": {
            "platform": "amd64",
            "arch": "x86_64"
          }
        }
      ]
    }
  },
  "versioning": {
    "pkgver": {
      "from": "manifest",
      "fallback": "3.7.0"
    },
    "pkgrel": {
      "from": "manifest",
      "fallback": 1
    }
  },
  "build": {
    "matrix": [
      {
        "platform": "amd64",
        "arch": "x86_64"
      },
      {
        "platform": "arm64",
        "arch": "aarch64_generic"
      },
      {
        "platform": "arm64",
        "arch": "aarch64_cortex-a53"
      },
      {
        "platform": "arm64",
        "arch": "aarch64_cortex-a72"
      },
      {
        "platform": "mipsel",
        "arch": "mipsel_24kc"
      }
    ],
    "include_dirs": [
      "scripts",
      "root",
      "pkgs"
    ],
    "pack": {
      "tool": "pica-pack",
      "format": "pkg.tar.gz"
    }
  },
  "publish": {
    "registry_db": "r/opkg/ua3f/db.json",
    "keep_release_history": 1
  }
}